{
  "version": "1.0",
  "caseId": "case_001",
  "metadata": {
    "title": "The Missing Heir",
    "description": "Investigate the disappearance of a wealthy businessman's son who vanished under mysterious circumstances",
    "difficulty": "Intermediate",
    "estimatedTimeMinutes": 90,
    "requiredRank": "Detective",
    "location": "Portland, Oregon",
    "incidentDate": "2025-12-15T14:30:00Z",
    "category": "Missing Person",
    "briefing": "You've been assigned to investigate the sudden disappearance of Thomas Blackwood Jr., son of prominent businessman Thomas Blackwood Sr. The young software engineer was last seen leaving his apartment building yesterday afternoon at approximately 2:30 PM. His father reported him missing this morning when Thomas Jr. failed to show up for an important company board meeting - highly unusual behavior for someone described as punctual and responsible. The Blackwood family's prominence in the Portland business community requires this case be handled with both discretion and urgency.",
    "victim": {
      "name": "Thomas Blackwood Jr.",
      "age": 28,
      "occupation": "Software Engineer",
      "lastSeen": "2025-12-15T14:30:00Z"
    }
  },
  "assets": [
    {
      "assetId": "asset.briefing_doc",
      "name": "Initial Case Briefing",
      "type": "document",
      "category": "Document",
      "description": "Official case assignment document from Chief of Police containing preliminary details about Thomas Blackwood Jr.'s disappearance",
      "filePath": "/cases/case_001/assets/briefing.pdf",
      "visibility": "initial",
      "metadata": {
        "pages": 2,
        "fileSize": "245KB",
        "format": "PDF"
      }
    },
    {
      "assetId": "asset.victim_photo",
      "name": "Photo of Thomas Blackwood Jr.",
      "type": "image",
      "category": "Document",
      "description": "Recent photograph of the missing person taken at company event three weeks ago",
      "filePath": "/cases/case_001/assets/victim_photo.jpg",
      "visibility": "initial",
      "metadata": {
        "resolution": "1920x1080",
        "dateTaken": "2025-11-22"
      }
    },
    {
      "assetId": "asset.phone_data",
      "name": "Victim's Mobile Phone",
      "type": "digital",
      "category": "Digital",
      "description": "Thomas Jr.'s smartphone found in his apartment - locked but intact, may contain call logs, messages, and app data",
      "filePath": "/cases/case_001/assets/phone_data.bin",
      "visibility": "hidden",
      "metadata": {
        "model": "iPhone 14 Pro",
        "condition": "Intact, password-locked"
      }
    }
  ],
  "emails": [
    {
      "emailId": "email.briefing_001",
      "from": "Chief Sarah Mitchell <chief@citypolice.gov>",
      "to": "Detective Alex Morgan <detective@citypolice.gov>",
      "subject": "URGENT: Missing Person Case Assignment",
      "sentAt": "2025-12-15T08:00:00Z",
      "priority": "high",
      "visibility": "initial",
      "content": "Detective Morgan,\n\nYou've been assigned to investigate the disappearance of Thomas Blackwood Jr., a 28-year-old software engineer who went missing yesterday afternoon. He was last seen leaving his downtown Portland apartment at 2:30 PM.\n\nHis father, Thomas Blackwood Sr., CEO of Blackwood Industries, reported him missing this morning when Thomas Jr. failed to attend a critical board meeting. According to Mr. Blackwood Sr., his son has never missed an important company obligation without notice.\n\nGiven the Blackwood family's prominence in our community, this case requires both urgency and discretion. I need you to follow every lead methodically while keeping media attention to a minimum.\n\nAttached you'll find the initial case briefing with preliminary details and a recent photo of Thomas Jr.\n\nKeep me updated on your progress.\n\nChief Mitchell\nPortland Police Department",
      "attachments": [
        "asset.briefing_doc",
        "asset.victim_photo"
      ],
      "metadata": {
        "thread": "case_assignment",
        "importance": "urgent"
      }
    },
    {
      "emailId": "email.forensics_phone_result",
      "from": "Digital Forensics Lab <digitallab@citypolice.gov>",
      "to": "Detective Alex Morgan <detective@citypolice.gov>",
      "subject": "Digital Forensics Analysis Results - Case #2025-1215",
      "sentAt": "2025-12-16T10:15:00Z",
      "priority": "normal",
      "visibility": "hidden",
      "content": "Detective Morgan,\n\nWe have completed the digital forensics analysis on the iPhone 14 Pro recovered from Thomas Blackwood Jr.'s apartment.\n\nKEY FINDINGS:\n\n1. Last Activity: Device was last used at 2:15 PM on December 15th, approximately 15 minutes before victim was last seen\n\n2. Call Logs: Three outgoing calls made on the day of disappearance:\n   - 10:30 AM to father (Thomas Sr.) - duration 4 minutes\n   - 1:45 PM to unknown number (503-555-0142) - duration 12 minutes\n   - 2:10 PM to same unknown number - duration 2 minutes\n\n3. Text Messages: Multiple deleted messages recovered from conversation with unknown number. Messages suggest a planned meeting at an undisclosed location.\n\n4. Location Data: GPS history shows victim visited an address in Northeast Portland (1247 Riverside Drive) twice in the week prior to disappearance.\n\nDetailed forensics report has been uploaded to evidence system.\n\nLet me know if you need any additional analysis.\n\nTech Specialist Rodriguez\nDigital Forensics Lab",
      "attachments": [],
      "metadata": {
        "thread": "forensics_results",
        "analysisType": "DigitalForensics"
      }
    }
  ],
  "suspects": [
    {
      "suspectId": "suspect.thomas_blackwood_sr",
      "name": "Thomas Blackwood Sr.",
      "age": 58,
      "occupation": "CEO, Blackwood Industries",
      "relationship": "Father of victim",
      "motive": "Recent financial disputes with son over company succession and business ethics disagreements",
      "alibi": "Claims to have been at company board meeting from 1:00 PM to 5:00 PM on December 15th",
      "alibiVerified": false,
      "background": "Thomas Blackwood Sr. is a self-made millionaire who built Blackwood Industries from a small manufacturing business into a multi-million dollar corporation over 30 years. Known in business circles for aggressive tactics and unwavering pursuit of profit. Colleagues describe him as demanding and controlling. Recent reports from company insiders suggest increasing tension between father and son regarding the future direction of the company, with Thomas Jr. reportedly opposing several ethically questionable business deals. Mr. Blackwood Sr. has expressed frustration to associates about his son's 'idealistic' approach to business and reluctance to 'do what it takes' to succeed.",
      "linkedAssets": [
        "asset.briefing_doc"
      ],
      "visibility": "initial"
    }
  ],
  "rules": [
    {
      "ruleId": "rule.forensics_phone_reveals_email",
      "trigger": {
        "type": "forensics_complete",
        "inputAssetId": "asset.phone_data",
        "analysisType": "DigitalForensics"
      },
      "actions": [
        {
          "type": "reveal_email",
          "emailId": "email.forensics_phone_result"
        }
      ]
    }
  ],
  "forensicsDefaults": {
    "analysisTypes": [
      {
        "type": "DNA",
        "durationMinutes": 300,
        "availableFor": ["blood", "hair", "saliva", "tissue"]
      },
      {
        "type": "Fingerprint",
        "durationMinutes": 150,
        "availableFor": ["print", "surface", "object"]
      },
      {
        "type": "DigitalForensics",
        "durationMinutes": 360,
        "availableFor": ["phone", "computer", "hard_drive", "usb", "digital"]
      },
      {
        "type": "Ballistics",
        "durationMinutes": 240,
        "availableFor": ["bullet", "casing", "firearm"]
      }
    ],
    "noFindingsEmail": {
      "template": "Detective,\n\nWe have completed the {{analysisType}} analysis on {{assetName}}. Unfortunately, the analysis did not reveal any actionable leads or evidence relevant to the investigation.\n\nIf you discover additional evidence that requires analysis, please submit it through the standard forensics request system.\n\nForensics Lab\nPortland Police Department",
      "from": "Forensics Lab <lab@citypolice.gov>",
      "subject": "Analysis Results - {{analysisType}} - No Findings"
    }
  }
}
